{
  "$schema": "https://json-schema.org/draft/2020-12/schema",
  "type": "object",
  "properties": {
    "schemaVersion": {
      "type": "integer",
      "exclusiveMinimum": 0,
      "maximum": 9007199254740991
    },
    "meta": {
      "type": "object",
      "properties": {
        "channel": {
          "type": "string"
        },
        "lastSyncedAt": {
          "type": "string"
        },
        "earliestRecordDate": {
          "type": "string"
        },
        "latestRecordDate": {
          "type": "string"
        },
        "syncSource": {
          "type": "string"
        },
        "coworkRunId": {
          "type": "string"
        },
        "rowCounts": {
          "type": "object",
          "propertyNames": {
            "type": "string"
          },
          "additionalProperties": {
            "type": "integer",
            "minimum": 0,
            "maximum": 9007199254740991
          }
        }
      },
      "required": [
        "channel",
        "lastSyncedAt",
        "earliestRecordDate",
        "latestRecordDate",
        "syncSource",
        "coworkRunId",
        "rowCounts"
      ],
      "additionalProperties": false
    },
    "daily": {
      "type": "array",
      "items": {
        "type": "object",
        "properties": {
          "date": {
            "type": "string"
          },
          "totalUsers": {
            "type": "integer",
            "minimum": 0,
            "maximum": 9007199254740991
          },
          "sessions": {
            "type": "integer",
            "minimum": 0,
            "maximum": 9007199254740991
          },
          "screenPageViews": {
            "type": "integer",
            "minimum": 0,
            "maximum": 9007199254740991
          },
          "engagedSessions": {
            "type": "integer",
            "minimum": 0,
            "maximum": 9007199254740991
          },
          "bouncedSessions": {
            "type": "integer",
            "minimum": 0,
            "maximum": 9007199254740991
          },
          "totalSessionDurationSec": {
            "type": "number",
            "minimum": 0
          }
        },
        "required": [
          "date",
          "totalUsers",
          "sessions",
          "screenPageViews",
          "engagedSessions",
          "bouncedSessions",
          "totalSessionDurationSec"
        ],
        "additionalProperties": false
      }
    },
    "channels": {
      "type": "array",
      "items": {
        "type": "object",
        "properties": {
          "date": {
            "type": "string"
          },
          "channelGroup": {
            "type": "string"
          },
          "sessions": {
            "type": "integer",
            "minimum": 0,
            "maximum": 9007199254740991
          },
          "engagedSessions": {
            "type": "integer",
            "minimum": 0,
            "maximum": 9007199254740991
          },
          "bouncedSessions": {
            "type": "integer",
            "minimum": 0,
            "maximum": 9007199254740991
          }
        },
        "required": [
          "date",
          "channelGroup",
          "sessions",
          "engagedSessions",
          "bouncedSessions"
        ],
        "additionalProperties": false
      }
    },
    "sources": {
      "type": "array",
      "items": {
        "type": "object",
        "properties": {
          "date": {
            "type": "string"
          },
          "source": {
            "type": "string"
          },
          "channelGroup": {
            "type": "string"
          },
          "sessions": {
            "type": "integer",
            "minimum": 0,
            "maximum": 9007199254740991
          },
          "engagedSessions": {
            "type": "integer",
            "minimum": 0,
            "maximum": 9007199254740991
          },
          "bouncedSessions": {
            "type": "integer",
            "minimum": 0,
            "maximum": 9007199254740991
          }
        },
        "required": [
          "date",
          "source",
          "channelGroup",
          "sessions",
          "engagedSessions",
          "bouncedSessions"
        ],
        "additionalProperties": false
      }
    },
    "pages": {
      "type": "array",
      "items": {
        "type": "object",
        "properties": {
          "date": {
            "type": "string"
          },
          "pagePath": {
            "type": "string"
          },
          "screenPageViews": {
            "type": "integer",
            "minimum": 0,
            "maximum": 9007199254740991
          },
          "totalUsers": {
            "type": "integer",
            "minimum": 0,
            "maximum": 9007199254740991
          },
          "engagedSessions": {
            "type": "integer",
            "minimum": 0,
            "maximum": 9007199254740991
          },
          "bouncedSessions": {
            "type": "integer",
            "minimum": 0,
            "maximum": 9007199254740991
          },
          "totalSessionDurationSec": {
            "type": "number",
            "minimum": 0
          }
        },
        "required": [
          "date",
          "pagePath",
          "screenPageViews",
          "totalUsers",
          "engagedSessions",
          "bouncedSessions",
          "totalSessionDurationSec"
        ],
        "additionalProperties": false
      }
    },
    "countries": {
      "type": "array",
      "items": {
        "type": "object",
        "properties": {
          "date": {
            "type": "string"
          },
          "country": {
            "type": "string"
          },
          "totalUsers": {
            "type": "integer",
            "minimum": 0,
            "maximum": 9007199254740991
          },
          "bouncedSessions": {
            "type": "integer",
            "minimum": 0,
            "maximum": 9007199254740991
          },
          "totalSessionDurationSec": {
            "type": "number",
            "minimum": 0
          }
        },
        "required": [
          "date",
          "country",
          "totalUsers",
          "bouncedSessions",
          "totalSessionDurationSec"
        ],
        "additionalProperties": false
      }
    },
    "devices": {
      "type": "array",
      "items": {
        "type": "object",
        "properties": {
          "date": {
            "type": "string"
          },
          "device": {
            "type": "string"
          },
          "sessions": {
            "type": "integer",
            "minimum": 0,
            "maximum": 9007199254740991
          },
          "engagedSessions": {
            "type": "integer",
            "minimum": 0,
            "maximum": 9007199254740991
          }
        },
        "required": [
          "date",
          "device",
          "sessions",
          "engagedSessions"
        ],
        "additionalProperties": false
      }
    },
    "paths": {
      "type": "array",
      "items": {
        "type": "object",
        "properties": {
          "date": {
            "type": "string"
          },
          "step1": {
            "type": "string"
          },
          "step2": {
            "type": "string"
          },
          "sessions": {
            "type": "integer",
            "minimum": 0,
            "maximum": 9007199254740991
          }
        },
        "required": [
          "date",
          "step1",
          "step2",
          "sessions"
        ],
        "additionalProperties": false
      }
    }
  },
  "required": [
    "schemaVersion",
    "meta",
    "daily",
    "channels",
    "sources",
    "pages",
    "countries",
    "devices",
    "paths"
  ],
  "additionalProperties": false
}
