{
  "schemaVersion": 1,
  "meta": {
    "channel": "ga4",
    "lastSyncedAt": "2026-08-10T09:03:11+05:30",
    "earliestRecordDate": "2026-05-01",
    "latestRecordDate": "2026-08-09",
    "coworkRunId": "run_2026-08-10T0900",
    "syncSource": "GA4 Data API",
    "rowCounts": {
      "daily": 92
    }
  },
  "daily": [
    {
      "date": "2026-06-01",
      "totalUsers": 30,
      "sessions": 58,
      "screenPageViews": 84,
      "engagedSessions": 38,
      "bouncedSessions": 20,
      "totalSessionDurationSec": 6135
    },
    {
      "date": "2026-06-02",
      "totalUsers": 34,
      "sessions": 58,
      "screenPageViews": 84,
      "engagedSessions": 38,
      "bouncedSessions": 20,
      "totalSessionDurationSec": 6135
    },
    {
      "date": "2026-06-03",
      "totalUsers": 38,
      "sessions": 58,
      "screenPageViews": 84,
      "engagedSessions": 38,
      "bouncedSessions": 20,
      "totalSessionDurationSec": 6135
    },
    {
      "date": "2026-06-04",
      "totalUsers": 42,
      "sessions": 58,
      "screenPageViews": 84,
      "engagedSessions": 38,
      "bouncedSessions": 20,
      "totalSessionDurationSec": 6135
    },
    {
      "date": "2026-06-05",
      "totalUsers": 46,
      "sessions": 58,
      "screenPageViews": 84,
      "engagedSessions": 38,
      "bouncedSessions": 20,
      "totalSessionDurationSec": 6135
    },
    {
      "date": "2026-06-06",
      "totalUsers": 50,
      "sessions": 58,
      "screenPageViews": 84,
      "engagedSessions": 38,
      "bouncedSessions": 20,
      "totalSessionDurationSec": 6135
    },
    {
      "date": "2026-06-07",
      "totalUsers": 54,
      "sessions": 58,
      "screenPageViews": 84,
      "engagedSessions": 38,
      "bouncedSessions": 20,
      "totalSessionDurationSec": 6135
    },
    {
      "date": "2026-06-08",
      "totalUsers": 58,
      "sessions": 58,
      "screenPageViews": 84,
      "engagedSessions": 38,
      "bouncedSessions": 20,
      "totalSessionDurationSec": 6135
    },
    {
      "date": "2026-06-09",
      "totalUsers": 62,
      "sessions": 58,
      "screenPageViews": 84,
      "engagedSessions": 38,
      "bouncedSessions": 20,
      "totalSessionDurationSec": 6135
    },
    {
      "date": "2026-06-10",
      "totalUsers": 66,
      "sessions": 58,
      "screenPageViews": 84,
      "engagedSessions": 38,
      "bouncedSessions": 20,
      "totalSessionDurationSec": 6135
    },
    {
      "date": "2026-06-11",
      "totalUsers": 70,
      "sessions": 57,
      "screenPageViews": 84,
      "engagedSessions": 38,
      "bouncedSessions": 20,
      "totalSessionDurationSec": 6135
    },
    {
      "date": "2026-06-12",
      "totalUsers": 30,
      "sessions": 57,
      "screenPageViews": 84,
      "engagedSessions": 38,
      "bouncedSessions": 20,
      "totalSessionDurationSec": 6135
    },
    {
      "date": "2026-06-13",
      "totalUsers": 34,
      "sessions": 57,
      "screenPageViews": 84,
      "engagedSessions": 38,
      "bouncedSessions": 20,
      "totalSessionDurationSec": 6135
    },
    {
      "date": "2026-06-14",
      "totalUsers": 38,
      "sessions": 57,
      "screenPageViews": 84,
      "engagedSessions": 37,
      "bouncedSessions": 20,
      "totalSessionDurationSec": 6135
    },
    {
      "date": "2026-06-15",
      "totalUsers": 42,
      "sessions": 57,
      "screenPageViews": 84,
      "engagedSessions": 37,
      "bouncedSessions": 20,
      "totalSessionDurationSec": 6135
    },
    {
      "date": "2026-06-16",
      "totalUsers": 46,
      "sessions": 57,
      "screenPageViews": 84,
      "engagedSessions": 37,
      "bouncedSessions": 20,
      "totalSessionDurationSec": 6135
    },
    {
      "date": "2026-06-17",
      "totalUsers": 50,
      "sessions": 57,
      "screenPageViews": 84,
      "engagedSessions": 37,
      "bouncedSessions": 20,
      "totalSessionDurationSec": 6135
    },
    {
      "date": "2026-06-18",
      "totalUsers": 54,
      "sessions": 57,
      "screenPageViews": 84,
      "engagedSessions": 37,
      "bouncedSessions": 20,
      "totalSessionDurationSec": 6135
    },
    {
      "date": "2026-06-19",
      "totalUsers": 58,
      "sessions": 57,
      "screenPageViews": 84,
      "engagedSessions": 37,
      "bouncedSessions": 20,
      "totalSessionDurationSec": 6135
    },
    {
      "date": "2026-06-20",
      "totalUsers": 62,
      "sessions": 57,
      "screenPageViews": 84,
      "engagedSessions": 37,
      "bouncedSessions": 20,
      "totalSessionDurationSec": 6135
    },
    {
      "date": "2026-06-21",
      "totalUsers": 66,
      "sessions": 57,
      "screenPageViews": 84,
      "engagedSessions": 37,
      "bouncedSessions": 20,
      "totalSessionDurationSec": 6134
    },
    {
      "date": "2026-06-22",
      "totalUsers": 70,
      "sessions": 57,
      "screenPageViews": 84,
      "engagedSessions": 37,
      "bouncedSessions": 20,
      "totalSessionDurationSec": 6134
    },
    {
      "date": "2026-06-23",
      "totalUsers": 30,
      "sessions": 57,
      "screenPageViews": 84,
      "engagedSessions": 37,
      "bouncedSessions": 20,
      "totalSessionDurationSec": 6134
    },
    {
      "date": "2026-06-24",
      "totalUsers": 34,
      "sessions": 57,
      "screenPageViews": 83,
      "engagedSessions": 37,
      "bouncedSessions": 20,
      "totalSessionDurationSec": 6134
    },
    {
      "date": "2026-06-25",
      "totalUsers": 38,
      "sessions": 57,
      "screenPageViews": 83,
      "engagedSessions": 37,
      "bouncedSessions": 20,
      "totalSessionDurationSec": 6134
    },
    {
      "date": "2026-06-26",
      "totalUsers": 42,
      "sessions": 57,
      "screenPageViews": 83,
      "engagedSessions": 37,
      "bouncedSessions": 20,
      "totalSessionDurationSec": 6134
    },
    {
      "date": "2026-06-27",
      "totalUsers": 46,
      "sessions": 57,
      "screenPageViews": 83,
      "engagedSessions": 37,
      "bouncedSessions": 20,
      "totalSessionDurationSec": 6134
    },
    {
      "date": "2026-06-28",
      "totalUsers": 50,
      "sessions": 57,
      "screenPageViews": 83,
      "engagedSessions": 37,
      "bouncedSessions": 19,
      "totalSessionDurationSec": 6134
    },
    {
      "date": "2026-06-29",
      "totalUsers": 54,
      "sessions": 57,
      "screenPageViews": 83,
      "engagedSessions": 37,
      "bouncedSessions": 19,
      "totalSessionDurationSec": 6134
    },
    {
      "date": "2026-06-30",
      "totalUsers": 58,
      "sessions": 57,
      "screenPageViews": 83,
      "engagedSessions": 37,
      "bouncedSessions": 19,
      "totalSessionDurationSec": 6134
    },
    {
      "date": "2026-05-01",
      "totalUsers": 25,
      "sessions": 40,
      "screenPageViews": 60,
      "engagedSessions": 22,
      "bouncedSessions": 12,
      "totalSessionDurationSec": 3800
    },
    {
      "date": "2026-05-02",
      "totalUsers": 28,
      "sessions": 44,
      "screenPageViews": 66,
      "engagedSessions": 25,
      "bouncedSessions": 14,
      "totalSessionDurationSec": 4180
    },
    {
      "date": "2026-05-03",
      "totalUsers": 31,
      "sessions": 48,
      "screenPageViews": 72,
      "engagedSessions": 28,
      "bouncedSessions": 16,
      "totalSessionDurationSec": 4560
    },
    {
      "date": "2026-05-04",
      "totalUsers": 34,
      "sessions": 52,
      "screenPageViews": 78,
      "engagedSessions": 31,
      "bouncedSessions": 18,
      "totalSessionDurationSec": 4940
    },
    {
      "date": "2026-05-05",
      "totalUsers": 37,
      "sessions": 56,
      "screenPageViews": 84,
      "engagedSessions": 34,
      "bouncedSessions": 20,
      "totalSessionDurationSec": 5320
    },
    {
      "date": "2026-05-06",
      "totalUsers": 40,
      "sessions": 60,
      "screenPageViews": 90,
      "engagedSessions": 37,
      "bouncedSessions": 22,
      "totalSessionDurationSec": 5700
    },
    {
      "date": "2026-05-07",
      "totalUsers": 43,
      "sessions": 64,
      "screenPageViews": 96,
      "engagedSessions": 40,
      "bouncedSessions": 12,
      "totalSessionDurationSec": 6080
    },
    {
      "date": "2026-05-08",
      "totalUsers": 46,
      "sessions": 68,
      "screenPageViews": 102,
      "engagedSessions": 43,
      "bouncedSessions": 14,
      "totalSessionDurationSec": 6460
    },
    {
      "date": "2026-05-09",
      "totalUsers": 49,
      "sessions": 72,
      "screenPageViews": 108,
      "engagedSessions": 22,
      "bouncedSessions": 16,
      "totalSessionDurationSec": 6840
    },
    {
      "date": "2026-05-10",
      "totalUsers": 25,
      "sessions": 76,
      "screenPageViews": 114,
      "engagedSessions": 25,
      "bouncedSessions": 18,
      "totalSessionDurationSec": 7220
    },
    {
      "date": "2026-05-11",
      "totalUsers": 28,
      "sessions": 40,
      "screenPageViews": 60,
      "engagedSessions": 28,
      "bouncedSessions": 20,
      "totalSessionDurationSec": 3800
    },
    {
      "date": "2026-05-12",
      "totalUsers": 31,
      "sessions": 44,
      "screenPageViews": 66,
      "engagedSessions": 31,
      "bouncedSessions": 22,
      "totalSessionDurationSec": 4180
    },
    {
      "date": "2026-05-13",
      "totalUsers": 34,
      "sessions": 48,
      "screenPageViews": 72,
      "engagedSessions": 34,
      "bouncedSessions": 12,
      "totalSessionDurationSec": 4560
    },
    {
      "date": "2026-05-14",
      "totalUsers": 37,
      "sessions": 52,
      "screenPageViews": 78,
      "engagedSessions": 37,
      "bouncedSessions": 14,
      "totalSessionDurationSec": 4940
    },
    {
      "date": "2026-05-15",
      "totalUsers": 40,
      "sessions": 56,
      "screenPageViews": 84,
      "engagedSessions": 40,
      "bouncedSessions": 16,
      "totalSessionDurationSec": 5320
    },
    {
      "date": "2026-05-16",
      "totalUsers": 43,
      "sessions": 60,
      "screenPageViews": 90,